{
  "id": "opera",
  "name": "Opera",
  "vendor": "Opera Software",
  "vendor_url": "https://opera.com",
  "category": "browser",
  "source_type": "app",
  "signatures": {
    "macos": {
      "bundle_id": "com.operasoftware.Opera"
    },
    "windows": {
      "exe_name": "opera.exe"
    },
    "linux": {
      "binary_name": "opera"
    }
  },
  "icon": "opera.png"
}
