{
  "id": "arc",
  "name": "Arc",
  "vendor": "The Browser Company",
  "vendor_url": "https://arc.net",
  "category": "browser",
  "source_type": "app",
  "signatures": {
    "macos": {
      "bundle_id": "company.thebrowser.Browser"
    },
    "windows": {
      "exe_name": "Arc.exe"
    }
  },
  "icon": "arc.png"
}
