{
  "id": "vivaldi",
  "name": "Vivaldi",
  "vendor": "Vivaldi Technologies",
  "vendor_url": "https://vivaldi.com",
  "category": "browser",
  "source_type": "app",
  "signatures": {
    "macos": {
      "bundle_id": "com.vivaldi.Vivaldi"
    },
    "windows": {
      "exe_name": "vivaldi.exe"
    },
    "linux": {
      "binary_name": "vivaldi"
    }
  },
  "icon": "vivaldi.png"
}
