{
  "id": "firefox",
  "name": "Firefox",
  "vendor": "Mozilla",
  "vendor_url": "https://mozilla.org/firefox",
  "category": "browser",
  "source_type": "app",
  "signatures": {
    "macos": {
      "bundle_id": "org.mozilla.firefox"
    },
    "windows": {
      "exe_name": "firefox.exe"
    },
    "linux": {
      "binary_name": "firefox"
    }
  },
  "icon": "firefox.png"
}
