{
  "id": "edge",
  "name": "Microsoft Edge",
  "vendor": "Microsoft",
  "vendor_url": "https://microsoft.com/edge",
  "category": "browser",
  "source_type": "app",
  "signatures": {
    "macos": {
      "bundle_id": "com.microsoft.edgemac"
    },
    "windows": {
      "exe_name": "msedge.exe"
    },
    "linux": {
      "binary_name": "msedge"
    }
  },
  "icon": "edge.png"
}
