{
  "id": "chrome",
  "name": "Google Chrome",
  "vendor": "Google",
  "vendor_url": "https://google.com/chrome",
  "category": "browser",
  "source_type": "app",
  "signatures": {
    "macos": {
      "bundle_id": "com.google.Chrome"
    },
    "windows": {
      "exe_name": "chrome.exe"
    },
    "linux": {
      "binary_name": "chrome"
    }
  },
  "icon": "google-chrome.png"
}
